{
  "version": "1.0",
  "project_state": "LEGACY",
  "current_state": "ZERO",
  "active_skill": null,
  "allowed_transitions": ["DISCOVERY"],
  "context_refs": {
    "include": [],
    "exclude": []
  },
  "last_validated_at": "2026-04-15T00:00:00Z",
  "validation_checksum": null,
  "feature_context": {
    "active_feature": null,
    "features": {},
    "dependency_graph": {}
  },
  "project_metadata": {
    "project": "hes",
    "stack": "Unknown",
    "ide": "claude-code",
    "domains": [],
    "harness_version": "3.4.0-dse",
    "agent_model": "single-agent",
    "user_language": "pt-BR",
    "audience_mode": "expert",
    "completed_cycles": 0
  },
  "session": {
    "checkpoint": null,
    "phase_lock": null,
    "messages_in_session": 0
  },
  "installation": {
    "installed_at": "2026-04-14T19:33:43-03:00",
    "installation_type": "auto",
    "auto_detected": true,
    "files_installed": 19,
    "validation_passed": true
  },
  "last_updated": "2026-04-15T00:00:00Z"
}
